{
  "$schema": "https://json-schema.org/draft/2020-12/schema",
  "$id": "https://internal.invalid/migration-skill-lab/skill-run-observations.schema.json",
  "title": "Migration Skill Run Observations",
  "type": "object",
  "additionalProperties": false,
  "required": [
    "schemaVersion",
    "artifactType",
    "skill",
    "skillVersion",
    "runId",
    "flowId",
    "capturedAt",
    "primaryOutcome",
    "observations"
  ],
  "properties": {
    "schemaVersion": { "const": 1 },
    "artifactType": { "const": "skill-run-observations" },
    "skill": {
      "type": "string",
      "enum": ["flow-baseline", "migrate-flow", "verify-flow", "debug-flow"]
    },
    "skillVersion": {
      "type": "string",
      "pattern": "^\\d+\\.\\d+\\.\\d+$"
    },
    "runId": {
      "type": "string",
      "pattern": "^[a-z0-9]+(?:-[a-z0-9]+)*$"
    },
    "flowId": {
      "type": "string",
      "pattern": "^[a-z0-9]+(?:-[a-z0-9]+)*$"
    },
    "capturedAt": {
      "type": "string",
      "pattern": "^\\d{4}-\\d{2}-\\d{2}T\\d{2}:\\d{2}:\\d{2}(?:\\.\\d+)?Z$"
    },
    "primaryOutcome": {
      "type": "object",
      "additionalProperties": false,
      "required": ["status", "summary"],
      "properties": {
        "status": {
          "type": "string",
          "enum": [
            "draft",
            "completed",
            "failed",
            "blocked",
            "PASS",
            "FAIL",
            "BLOCKED"
          ]
        },
        "summary": { "type": "string", "minLength": 1 },
        "artifactPath": { "type": "string", "minLength": 1 },
        "sha256": {
          "type": "string",
          "pattern": "^[a-f0-9]{64}$"
        }
      }
    },
    "observations": {
      "type": "array",
      "uniqueItems": true,
      "items": {
        "type": "object",
        "additionalProperties": false,
        "required": [
          "id",
          "category",
          "observation",
          "effect",
          "evidence",
          "skillLocations",
          "causality",
          "occurrenceCount"
        ],
        "properties": {
          "id": {
            "type": "string",
            "pattern": "^[a-z0-9]+(?:-[a-z0-9]+)*$"
          },
          "category": {
            "type": "string",
            "enum": [
              "user-correction",
              "instruction-deviation",
              "skill-caused-tool-failure",
              "ambiguous-instruction",
              "missing-failure-handling",
              "unnecessary-context-load",
              "unsuitable-delegation",
              "deterministic-step-candidate",
              "output-mismatch"
            ]
          },
          "observation": { "type": "string", "minLength": 1 },
          "effect": {
            "type": "string",
            "enum": [
              "safety",
              "correctness",
              "cost",
              "clarity",
              "user-experience"
            ]
          },
          "evidence": {
            "type": "array",
            "minItems": 1,
            "uniqueItems": true,
            "items": { "type": "string", "minLength": 1 }
          },
          "skillLocations": {
            "type": "array",
            "minItems": 1,
            "uniqueItems": true,
            "items": { "type": "string", "minLength": 1 }
          },
          "causality": {
            "type": "string",
            "enum": ["confirmed", "inferred"]
          },
          "occurrenceCount": {
            "type": "integer",
            "minimum": 1
          }
        }
      }
    }
  }
}
